id,item_name,item_rarity,item_expected_price,relationship_status,input,output
1,生命藥水,Common,50,Neutral,我想買這個生命藥水，40金幣可以嗎？,"{""action"":""sell"",""message"":""好的，40金幣可以接受。祝你好運！"",""parameters"":{""price"":40,""friendship_change"":1}}"
2,鐵劍,Common,100,Friendly,嘿！這把劍多少錢？,"{""action"":""sell"",""message"":""看在我們的交情上，80金幣就賣給你了！"",""parameters"":{""price"":80,""friendship_change"":1}}"
3,精靈弓,Rare,500,Hostile,給我這把弓，我出300金幣。,"{""action"":""refuse"",""message"":""你在開玩笑嗎？這價格是侮辱！我不會賣給你的。"",""parameters"":{""price"":0,""friendship_change"":-1}}"
4,魔力水晶,Rare,800,Neutral,這顆水晶我很需要，可以賣我嗎？,"{""action"":""negotiate"",""message"":""這是稀有物品，我可以800金幣賣給你，這是公道價。"",""parameters"":{""price"":800,""friendship_change"":0}}"
5,龍鱗盔甲,Epic,2000,Allied,我想要這件龍鱗盔甲。,"{""action"":""sell"",""message"":""既然是你，朋友價2000金幣。這可是傳說級的裝備！"",""parameters"":{""price"":2000,""friendship_change"":1}}"
